id,contrat,titre,texte,notice,page
axa_avizen_2025-04_formule_01,Avizen,Prestation invalidité (rente ou capital),autre · prestation = montant_garanti_à_la_consolidation × n(taux_invalidité_fonctionnelle) / 100 · justification : Règle explicite aux §2.2.3 à 2.2.6 : « montant… multiplié par le taux d'indemnisation (n) ».,2025-04 Notice d'information Avizen.pdf,16
axa_avizen_2025-04_formule_02,Avizen,Exonération ITT,cotisation · remboursement = (cotisation_annuelle / 365) × jours_d_arrêt_total_indemnisés · justification : Énoncé littéral au §2.2.7 (1/365e par jour indemnisé).,2025-04 Notice d'information Avizen.pdf,17
axa_avizen_2025-04_formule_03,Avizen,Taux d'indemnisation zone linéaire 11-30 %,"autre · pour 11 ≤ t ≤ 30 : n = 1,5 × (t − 10) ; au-delà de 30 la progression n'est plus linéaire (lecture du tableau obligatoire) ; t ≥ 66 : n = 100 · justification : Vérifiée sur les 20 premières valeurs du tableau (11→1,5 ; 20→15 ; 30→30). Au-delà de 30 % les valeurs (31→31,14…65→86,04) ne suivent pas de formule simple identifiable : utiliser le tableau.",2025-04 Notice d'information Avizen.pdf,16
axa_avizen_pro_2025-04_formule_01,Avizen Pro,Prestation invalidité (croisé),"autre · prestation = montant_certificat × taux_indemnisation(taux_croisé(prof, fonctionnel)) / 100 · justification : Mécanique explicite §2.2.5-2.2.6 avec les deux tableaux contractuels.",2025-04 Notice d'information Avizen Pro (AEP).pdf,19
axa_avizen_pro_2025-04_formule_02,Avizen Pro,Prestation invalidité (option professionnelle),"autre · si 11/15/33 ≤ n < 66 : taux_indemnisation = n/66 ; si n ≥ 66 : 100 % ; prestation = montant_certificat × taux_indemnisation · justification : Formule et exemples chiffrés écrits en toutes lettres (50 % → 75,76 %).",2025-04 Notice d'information Avizen Pro (AEP).pdf,20
axa_avizen_pro_2025-04_formule_03,Avizen Pro,Exonération ITT,cotisation · remboursement = cotisation_annuelle/365 × jours_indemnisés · justification : Énoncé littéral §2.2.9.,2025-04 Notice d'information Avizen Pro (AEP).pdf,24
axa_entourage_2025-06_formule_01,Entour'Age,Rente dépendance totale,"autre · rente_mensuelle = montant_souscrit × taux_revalorisation(adhésion→reconnaissance) × coefficient_réduction_éventuel ; en dépendance partielle : × 0,5 · justification : Formule décrite explicitement comme « le produit des éléments suivants » au §4.3.1.1.",2025-06 Notice d'Information Entour'Age.pdf,21
axa_entourage_2025-06_formule_02,Entour'Age,Capital décès remboursement des cotisations,autre · capital = Σ cotisations versées (nettes des frais de fractionnement) entre la date d'effet de la garantie et la date du décès · justification : Énoncé littéral §6.2.2.,2025-06 Notice d'Information Entour'Age.pdf,27
axa_essenciel_2025-06_formule_01,Essen'Ciel (assurance obsèques),Capital revalorisé,"autre · capital(t) = capital_souscrit × 1,01^t (+ participation aux bénéfices éventuelle) · justification : Revalorisation contractuelle garantie de 1 %/an ; vérifiée sur l'exemple p.7 : 5 000 × 1,01^12 = 5 634 ? Non : l'exemple contractuel donne 5 804,92 € (+16 %), supérieur à 1,01^12 (+12,7 %) — l'exemple semble inclure d'autres revalorisations ou une base différente : voir zones_ambiguës. La formule en composé simple reste l'interprétation littérale du §5.2.1.",2025-06 Notice d'information Essen'Ciel.pdf,20
axa_essenciel_2025-06_formule_02,Essen'Ciel (assurance obsèques),Pénalité de rachat,"valeur_de_rachat · pénalité(année n) = max(0 ; 5 % − 0,5 % × (n − 1)) × valeur_de_rachat, nulle à partir de la 11e année · justification : Texte explicite : 5 % la 1re année, -0,5 %/an, nulle au-delà de la 10e année.",2025-06 Notice d'information Essen'Ciel.pdf,33
axa_essenciel_2025-06_formule_03,Essen'Ciel (assurance obsèques),Valeur de rachat,"valeur_de_rachat · VR(t) = provision mathématique(t) − pénalité éventuelle ; PM = engagement futur de l'assureur − engagement futur de l'assuré (calcul actuariel non reproduit dans la notice ; seuls les tableaux d'exemples chiffrés sont contractuels) · justification : Définition donnée mais paramètres actuariels (tables, taux) non publiés : seuls les minima des tableaux sont garantis.",2025-06 Notice d'information Essen'Ciel.pdf,35
axa_excelium_vie_2026-05_formule_01,Excelium (assurance vie),Valeur de rachat minimale support euros,"valeur_de_rachat · VR(n) = versement_net_initial × (1 − 0,008)^n · justification : Formule écrite en toutes lettres p.47 et vérifiée sur le tableau (2 500 → 2 480 → … → 2 307).",2026-05 Notice Excelium Vie.pdf,46
axa_excelium_vie_2026-05_formule_02,Excelium (assurance vie),Nombre d'UC/parts après frais,"valeur_de_rachat · N(n) = N0 × (1 − taux_mensuel)^(12n), avec taux_mensuel = 0,0669 % (Croissance), 0,0804 % (UC standard), 0,1014 % (UC pilotée), 0,1259 % (AXA Immo Avenir) · justification : Exemples de calcul explicites p.47 (99,200 = 100 × (1−0,0669 %)^12, etc.).",2026-05 Notice Excelium Vie.pdf,47
axa_excelium_vie_2026-05_formule_03,Excelium (assurance vie),Prime mensuelle garantie Revalorisée,"cotisation · prime = capital_sous_risque_fin_de_mois × tarif_mensuel(âge) · justification : Formule contractuelle explicite (p.17 et p.48) + exemples chiffrés vérifiés (250 € × 0,0142 % = 0,0355 ≈ 0,04 €).",2026-05 Notice Excelium Vie.pdf,17
axa_excelium_vie_2026-05_formule_04,Excelium (assurance vie),Montant garanti Revalorisée,"autre · MG = Σ versements_nets × Π(1 + taux_mensuel_LivretA) sur la période [mois suivant l'encaissement ; mois précédant le décès] − minorations proportionnelles aux rachats · justification : Description littérale §4.2.2 ; le mode exact de composition mensuelle du taux Livret A n'est pas formalisé en équation dans la notice.",2026-05 Notice Excelium Vie.pdf,16
axa_ma_protection_accident_2024-03_formule_01,Ma Protection Accident (Garantie des accidents de la vie),Indice AQV,"autre · AQV = arrondi_supérieur(DFP + PEP + SE) ; indemnité = tableau[AQV][tranche d'âge à la consolidation] · justification : Formule explicitement décrite p.7 (« par addition ») avec exemple chiffré p.9 vérifié contre le tableau.",2024-03 CG Ma Protection Accident (AGA-AEP).pdf,8
axa_ma_protection_accident_2024-03_formule_02,Ma Protection Accident (Garantie des accidents de la vie),Renonciation vente à distance — cotisation due,cotisation · montant_dû = cotisation_annuelle × nombre_de_jours_garantis / 365 · justification : Règle de calcul écrite en toutes lettres p.19.,2024-03 CG Ma Protection Accident (AGA-AEP).pdf,19
axa_ma_retraite_2026-05_formule_01,Ma Retraite (plan d'épargne retraite individuel — PER),Valeur de transfert en parts/UC,"autre · N(1) = N0 × (1 − taux_mensuel)^12 × (1 − 1 % si transfert < 5 ans) ; taux_mensuel = 0,0669 % (Croissance), 0,0804 % (UC), 0,1259 % (AXA Immo Avenir) · justification : Exemples de calcul écrits en toutes lettres p.28-29 (98,208 = 100 × (1−0,0669 %)^12 × (1−1 %)).",2026-05 Notice Ma Retraite.pdf,28
axa_ma_retraite_2026-05_formule_02,Ma Retraite (plan d'épargne retraite individuel — PER),Rente initiale,"autre · rente_annuelle = Σ_versements [épargne_relative_au_versement × coefficient(année_retraite, âge ; table en vigueur à la date du versement)] ; frais 1 % par arrérage déjà intégrés aux coefficients · justification : Mécanique Protection Retraite (5.1.3) + annexe 13 ; la composition exacte multi-versements/multi-tables est décrite textuellement (« la proportion de l'épargne constituée relative audit versement »).",2026-05 Notice Ma Retraite.pdf,48
axa_masterlife_credit_2024-10_formule_01,Masterlife CREDIT,IJ incapacité (plafond),"autre · IJ_max = échéance_du_prêt / N × quotité, avec N = 30 (mensuel), 90 (trimestriel), 180 (semestriel), 365 (annuel) ; prêt in fine : IJ = intérêts_annuels/365 · justification : Règles écrites en toutes lettres à l'article 4.1.a.",Notice-Masterlife-Credit-202410.pdf,12
axa_masterlife_credit_2024-10_formule_02,Masterlife CREDIT,IJ invalidité partielle,"autre · IJ = IJ_max × n_indemnisation(taux_croisé)/100, pour 33 ≤ taux < 66 ; 100 % si ≥ 66 ; 0 si < 33 · justification : Article 4.2.a + tableaux contractuels.",Notice-Masterlife-Credit-202410.pdf,15
axa_masterlife_credit_2024-10_formule_03,Masterlife CREDIT,Exonération incapacité,"cotisation · remboursement = cotisation_annuelle/365 × max(0, jours_incapacité − 90) · justification : « 1/365e par journée d'incapacité » avec « déduction d'une franchise de 90 jours » — l'application exacte de la franchise (en jours déduits) est l'interprétation la plus directe du texte.",Notice-Masterlife-Credit-202410.pdf,16
